{
  "schema_version": "alliance.insurance_request.v2",
  "request": {
    "request_number": "20213-ЛТ-КЗ",
    "submission_date": "2025-08-12",
    "applicant_type": "legal_entity",
    "application_format": "casco_equipment",
    "branch": {
      "name": "Казань"
    },
    "manager": {
      "full_name": "Иванов Иван"
    }
  },
  "customer": {
    "type": "legal_entity",
    "name": "ООО Ромашка",
    "inn": "1660123456",
    "legal_address": "420000, Татарстан Респ, Казань г, ул. Примерная, дом № 1",
    "postal_address": "420000, Татарстан Респ, Казань г, ул. Примерная, дом № 1",
    "business_activity": "42.11 Строительство автомобильных дорог и автомагистралей"
  },
  "lease": {
    "creditor_bank": "ПАО Сбербанк",
    "insured_party": "lessor"
  },
  "insurance": {
    "product": "equipment",
    "period": {
      "kind": "full_lease",
      "text": "на весь срок лизинга"
    },
    "territory": null,
    "coverage_terms": {
      "insured_sum_type": "non_aggregate",
      "guard_conditions": "без ограничений",
      "property_location_right_holder": null
    },
    "franchise": {
      "mode": "both_variants",
      "text": "с фр. 100 тыс и без"
    },
    "premium_payment": {
      "mode": "installment",
      "frequency": "quarterly"
    }
  },
  "insured_object": {
    "object_type": "special_equipment",
    "description": "Мини-погрузчик Sunward SWL 4028, 2024 г.в.",
    "brand": "Sunward",
    "model": "SWL 4028",
    "manufacturing_year": 2024,
    "condition": "new",
    "equipment_type": "колесный",
    "power_or_capacity": "39.7 кВт",
    "acquisition_cost": {
      "value": 2950000,
      "currency": "RUB"
    }
  },
  "underwriting": {
    "usage_purposes": "Строительство автомобильных дорог",
    "autostart": false,
    "casco_category_ce": false,
    "transportation_required": false,
    "construction_work_required": false,
    "key_completeness": "2 ключа",
    "title_document": "ПСМ",
    "telematics_complex": null
  },
  "notes": []
}
