{
  "schema_version": "alliance.insurance_request.v2",
  "request": {
    "request_number": "ОБ-20165-ЛО-КЗ",
    "submission_date": "2025-07-24",
    "applicant_type": "legal_entity",
    "application_format": "property",
    "branch": {
      "name": "Казань"
    },
    "manager": {
      "full_name": "Иванов Иван"
    }
  },
  "customer": {
    "type": "legal_entity",
    "name": "ДОРМАСТЕР ООО",
    "inn": "1645024000",
    "legal_address": "422000, Татарстан Респ, Казань г, Промышленный пр-кт, дом № 14",
    "postal_address": "422000, Татарстан Респ, Казань г, Промышленный пр-кт, дом № 14",
    "business_activity": "42.11 Строительство автомобильных дорог и автомагистралей"
  },
  "lease": {
    "creditor_bank": "АО Альфа-Банк",
    "insured_party": "lessor"
  },
  "insurance": {
    "product": "property",
    "period": {
      "kind": "custom",
      "text": "на 14 месяцев и перевозка"
    },
    "territory": "Российская Федерация",
    "coverage_terms": {
      "insured_sum_type": "non_aggregate",
      "guard_conditions": "ангар с круглосуточной охраной",
      "property_location_right_holder": "lessee_owner"
    },
    "franchise": {
      "mode": "none",
      "text": "Нет франшизы"
    },
    "premium_payment": {
      "mode": "single",
      "frequency": "single"
    }
  },
  "insured_object": {
    "object_type": "equipment",
    "description": "Дизель-электростанция АД-120С-Т400-2РКМ19-Ricardo",
    "brand": "Ricardo",
    "model": "АД-120С-Т400-2РКМ19",
    "manufacturing_year": 2025,
    "condition": "new",
    "equipment_type": "стационарная",
    "power_or_capacity": "120 кВт",
    "acquisition_cost": {
      "value": 3200000,
      "currency": "RUB"
    }
  },
  "underwriting": {
    "usage_purposes": "Резервное электроснабжение строительной техники",
    "autostart": false,
    "casco_category_ce": false,
    "transportation_required": true,
    "transportation_departure": "МО, г. Серпухов, переулок Центральный, дом 31А",
    "transportation_destination": "г.Казань, ул.Южно-Промышленная, 12В",
    "transportation_days": 1,
    "construction_work_required": false,
    "key_completeness": null,
    "title_document": null,
    "telematics_complex": null
  },
  "notes": [
    "Требуется услуга перевозки оборудования."
  ]
}
